{
  "$schema":"contracts/artifact-contracts/native-application-admission-policy.schema.json","kind":"NativeApplicationAdmissionPolicy","version":"1.0.0","app_id":"thunderbird","desktop_entry_refs":["thunderbird.desktop","org.mozilla.Thunderbird.desktop"],"enabled":true,
  "runtime":{"required_capability":"user.native_workspace","allowed_profile_ids":["user_lightweight"]},
  "security":{"class":"mail","network":"required","audio":"optional","gpu":"denied"},
  "resources":{"resource_envelope_ref":"native.background-interactive","workload_class":"background_interactive","resource_request":{"cpu":{"unit":"millicores","reservation":50,"limit":1800},"memory":{"unit":"MiB","reservation":256,"limit":3072},"processes":{"unit":"processes","reservation":1,"limit":128}},"criticality":"interactive","priority":65},
  "offline_behavior":"degraded","data_policy_ref":"data/thunderbird.json",
  "launch":{"allowed_actions":["launch","open_uri","open_resource"],"allowed_uri_schemes":["mailto"],"allowed_resource_scopes":["downloads","documents"]}
}
