{
  "$schema":"contracts/artifact-contracts/native-application-admission-policy.schema.json","kind":"NativeApplicationAdmissionPolicy","version":"1.0.0","app_id":"vlc","desktop_entry_refs":["vlc.desktop"],"enabled":true,
  "runtime":{"required_capability":"user.native_workspace","allowed_profile_ids":["user_lightweight"]},
  "security":{"class":"media","network":"optional","audio":"required","gpu":"optional"},
  "resources":{"resource_envelope_ref":"native.foreground-media","workload_class":"foreground_media","resource_request":{"cpu":{"unit":"millicores","reservation":100,"limit":3000},"memory":{"unit":"MiB","reservation":128,"limit":2048},"processes":{"unit":"processes","reservation":1,"limit":96}},"criticality":"interactive","priority":75},
  "offline_behavior":"available","data_policy_ref":"data/vlc.json",
  "launch":{"allowed_actions":["launch","open_resource"],"allowed_uri_schemes":[],"allowed_resource_scopes":["downloads","music","videos"]}
}
