{
  "$schema":"contracts/artifact-contracts/native-application-admission-policy.schema.json","kind":"NativeApplicationAdmissionPolicy","version":"1.0.0","app_id":"libreoffice","desktop_entry_refs":["libreoffice-startcenter.desktop","org.libreoffice.LibreOffice.desktop"],"enabled":true,
  "runtime":{"required_capability":"user.native_workspace","allowed_profile_ids":["user_lightweight"]},
  "security":{"class":"office","network":"optional","audio":"denied","gpu":"optional"},
  "resources":{"resource_envelope_ref":"native.interactive-office","workload_class":"interactive_office","resource_request":{"cpu":{"unit":"millicores","reservation":100,"limit":2500},"memory":{"unit":"MiB","reservation":256,"limit":3072},"processes":{"unit":"processes","reservation":1,"limit":128}},"criticality":"interactive","priority":70},
  "offline_behavior":"available","data_policy_ref":"data/libreoffice.json",
  "launch":{"allowed_actions":["launch","open_resource"],"allowed_uri_schemes":[],"allowed_resource_scopes":["documents","downloads","desktop"]}
}
